{
  "$schema": "https://json-schema.org/draft/2020-12/schema",
  "$id": "https://raw.githubusercontent.com/GLOBAL-AI-GOVERNANCE/governed-systems-administration/main/schemas/system-context.schema.json",
  "title": "SystemContext",
  "type": "object",
  "additionalProperties": false,
  "required": [
    "schema_version",
    "context_id",
    "request_id",
    "platform",
    "shell",
    "working_directory",
    "effective_identity",
    "privilege",
    "source_classification",
    "context_status",
    "executable_resolution",
    "remote_target_declared",
    "target_resolution"
  ],
  "properties": {
    "schema_version": {
      "const": "0.1.0-alpha.1"
    },
    "context_id": {
      "$ref": "common.schema.json#/$defs/id"
    },
    "request_id": {
      "$ref": "common.schema.json#/$defs/id"
    },
    "platform": {
      "$ref": "common.schema.json#/$defs/platform"
    },
    "shell": {
      "$ref": "common.schema.json#/$defs/shell"
    },
    "working_directory": {
      "type": [
        "string",
        "null"
      ],
      "maxLength": 1024
    },
    "effective_identity": {
      "type": "string",
      "minLength": 1,
      "maxLength": 128
    },
    "privilege": {
      "$ref": "common.schema.json#/$defs/privilege"
    },
    "source_classification": {
      "$ref": "common.schema.json#/$defs/source_classification"
    },
    "context_status": {
      "$ref": "common.schema.json#/$defs/context_status"
    },
    "executable_resolution": {
      "type": "object",
      "additionalProperties": false,
      "required": [
        "status",
        "canonical_name"
      ],
      "properties": {
        "status": {
          "enum": [
            "RESOLVED",
            "UNRESOLVED"
          ]
        },
        "canonical_name": {
          "type": [
            "string",
            "null"
          ],
          "maxLength": 128
        }
      },
      "allOf": [
        {
          "if": {
            "properties": {
              "status": {
                "const": "RESOLVED"
              }
            },
            "required": [
              "status"
            ]
          },
          "then": {
            "properties": {
              "canonical_name": {
                "type": "string",
                "minLength": 1
              }
            }
          }
        },
        {
          "if": {
            "properties": {
              "status": {
                "const": "UNRESOLVED"
              }
            },
            "required": [
              "status"
            ]
          },
          "then": {
            "properties": {
              "canonical_name": {
                "type": "null"
              }
            }
          }
        }
      ]
    },
    "remote_target_declared": {
      "type": "boolean"
    },
    "target_resolution": {
      "type": "object",
      "additionalProperties": false,
      "required": [
        "status",
        "count",
        "existence"
      ],
      "properties": {
        "status": {
          "$ref": "common.schema.json#/$defs/target_status"
        },
        "count": {
          "type": "integer",
          "minimum": 0,
          "maximum": 1000000
        },
        "existence": {
          "$ref": "common.schema.json#/$defs/target_existence"
        }
      },
      "allOf": [
        {
          "if": {
            "properties": {
              "status": {
                "const": "NOT_APPLICABLE"
              }
            },
            "required": [
              "status"
            ]
          },
          "then": {
            "properties": {
              "count": {
                "const": 0
              },
              "existence": {
                "const": "NOT_APPLICABLE"
              }
            }
          }
        },
        {
          "if": {
            "properties": {
              "status": {
                "const": "RESOLVED_EMPTY"
              }
            },
            "required": [
              "status"
            ]
          },
          "then": {
            "properties": {
              "count": {
                "const": 0
              },
              "existence": {
                "const": "TARGET_ABSENT"
              }
            }
          }
        },
        {
          "if": {
            "properties": {
              "status": {
                "const": "RESOLVED_WITHIN_LIMIT"
              }
            },
            "required": [
              "status"
            ]
          },
          "then": {
            "properties": {
              "count": {
                "minimum": 1,
                "maximum": 32
              },
              "existence": {
                "enum": [
                  "TARGET_ABSENT",
                  "TARGET_PRESENT_FILE"
                ]
              }
            }
          }
        },
        {
          "if": {
            "properties": {
              "status": {
                "const": "RESOLVED_OVER_LIMIT"
              }
            },
            "required": [
              "status"
            ]
          },
          "then": {
            "properties": {
              "count": {
                "minimum": 33
              },
              "existence": {
                "const": "TARGET_PRESENT_FILE"
              }
            }
          }
        },
        {
          "if": {
            "properties": {
              "status": {
                "const": "UNRESOLVED"
              }
            },
            "required": [
              "status"
            ]
          },
          "then": {
            "properties": {
              "count": {
                "const": 0
              },
              "existence": {
                "enum": [
                  "TARGET_PRESENT_NONFILE",
                  "TARGET_UNKNOWN"
                ]
              }
            }
          }
        }
      ]
    }
  },
  "allOf": [
    {
      "if": {
        "properties": {
          "platform": {
            "const": "LINUX"
          }
        },
        "required": [
          "platform"
        ]
      },
      "then": {
        "properties": {
          "shell": {
            "const": "BASH"
          }
        }
      }
    },
    {
      "if": {
        "properties": {
          "platform": {
            "const": "WINDOWS"
          }
        },
        "required": [
          "platform"
        ]
      },
      "then": {
        "properties": {
          "shell": {
            "const": "POWERSHELL"
          }
        }
      }
    },
    {
      "if": {
        "properties": {
          "context_status": {
            "const": "COMPLETE"
          }
        },
        "required": [
          "context_status"
        ]
      },
      "then": {
        "properties": {
          "working_directory": {
            "type": "string",
            "minLength": 1
          },
          "executable_resolution": {
            "properties": {
              "status": {
                "const": "RESOLVED"
              }
            }
          }
        }
      }
    }
  ],
  "$comment": "Proposed normative; approval status under review; product implementation not started."
}
